{
  "$schema": "http://json-schema.org/draft-07/schema#",
  "type": "object",
  "required": ["name", "session_name", "exercises", "date_created"],
  "properties": {
    "name": {
      "type": "string",
      "description": "Human-readable name of the session (e.g., 'Push Day')"
    },
    "session_name": {
      "type": "string",
      "description": "Slugified name used for filename (e.g., 'push_day')"
    },
    "exercises": {
      "type": "array",
      "description": "List of exercises in this session",
      "items": {
        "type": "object",
        "required": ["exercise_name", "sets", "reps", "percent_1rm"],
        "properties": {
          "exercise_name": {
            "type": "string",
            "description": "Name of the exercise (must reference an exercise file in exercises/ directory)"
          },
          "sets": {
            "type": "integer",
            "description": "Number of sets for this exercise in this session"
          },
          "reps": {
            "type": "integer",
            "description": "Number of reps per set"
          },
          "percent_1rm": {
            "type": "number",
            "description": "Percentage of 1RM to use for this exercise (weight is computed from exercise 1rm * percent_1rm)"
          }
        }
      }
    },
    "date_created": {
      "type": "string",
      "description": "Datetime in format YYYY-MM-DD-<unix epoch seconds>"
    }
  }
}
